<?xml version="1.0" encoding="UTF-8"?>
<collection-import xmlns:xsi="http://www.w3.org/2001/XMLSchema-instance"
	xsi:schemaLocation="http://msqr.us/xsd/matte ../../../../../../src/magoffin/matt/ma2/biz/import.xsd"
	xmlns="http://msqr.us/xsd/matte">
	<album name="My Test Import With XML Album" sort="date">
		<comment>This is a test album, testing comments. here.</comment>
		<item archive-path="My Test Import With XML Album/bee-action.jpg" name="Bee Action" rating="5">
			<comment>See the bee, in action!</comment>
			<keywords>bee, test</keywords>
		</item>
		<item archive-path="My Test Import With XML Album/IMG_4215.jpg" name="Henrietta feeds her chicks">
			<comment>Henrietta back with some tasty worms or insects for 
				her hungry chicks.</comment>
			<meta name="FOO">bar</meta>
		</item>
	</album>
</collection-import>
